{
  "$schema": "https://json-schema.org/draft/2020-12/schema",
  "$id": "https://github.com/zommuter/dotclaude-skills/tracker/schema/ledger-intermediate.schema.json",
  "title": "Ledger intermediate document",
  "description": "Tool-independent intermediate representation of this fleet's bespoke markdown ledgers (TODO.md / TODO.archive.md / ROADMAP.md / ROADMAP.archive.md / REVIEW_ME.md). Produced by tracker/ledger-map.py, consumed by the Plane and Vikunja adapters (id:90f2). Prose contract: tracker/SCHEMA.md. TODO id:2bb1.",
  "type": "object",
  "required": ["schema_version", "repos", "items", "unmapped", "unmapped_counts"],
  "additionalProperties": true,
  "properties": {
    "schema_version": {
      "const": "1.0.0",
      "description": "Contract-surface version marker. This repo has NO repo-wide version (CLAUDE.md Versioning); this marker exists because a stale adapter reading a changed document fails SILENTLY. Bump on any change to required keys or enums; adapters must refuse a version they do not know."
    },
    "repos": {
      "type": "array",
      "items": { "$ref": "#/$defs/repo" }
    },
    "items": {
      "type": "array",
      "items": { "$ref": "#/$defs/item" }
    },
    "unmapped": {
      "type": "array",
      "description": "Loud-lossy report: every ledger construct this mapping does not carry. Never empty-by-silence — id:4347 no-silent-swallow.",
      "items": { "$ref": "#/$defs/unmapped" }
    },
    "unmapped_counts": {
      "type": "object",
      "description": "construct -> count, so a consumer can assert the lossy surface is shrinking without reading every entry.",
      "additionalProperties": { "type": "integer", "minimum": 0 }
    }
  },
  "$defs": {
    "repo": {
      "type": "object",
      "required": ["repo", "path", "verdict", "labels"],
      "additionalProperties": true,
      "properties": {
        "repo": { "type": "string", "description": "Repo name — the first half of the composite (repo, id) key." },
        "path": { "type": "string" },
        "verdict": {
          "description": "classify-repo.sh's per-repo verdict (relay-poolable / needs-feedback / design-drained / idle / blocked). Filled by id:c17d; null from this mapper, which does not run the classifier.",
          "anyOf": [{ "type": "string" }, { "type": "null" }]
        },
        "labels": { "type": "array", "items": { "type": "string" } },
        "ledger_files": { "type": "array", "items": { "type": "string" } }
      }
    },
    "item": {
      "type": "object",
      "required": [
        "uid", "repo", "id", "identity", "kind", "title",
        "todo_status", "roadmap_status", "review_status", "drift", "derived_status",
        "labels", "blocked_by", "links", "sources"
      ],
      "additionalProperties": true,
      "properties": {
        "uid": {
          "type": "string",
          "pattern": "^[^/]+/(?:[0-9a-f]{4}|~[0-9a-f]{12})$",
          "description": "'<repo>/<key>' — the composite key. <key> is the 4-hex id for a tracked item, or a '~'-prefixed content hash for an id-less one. 4-hex ids are PER-REPO and never fleet-unique (TODO id:c3f6 caveat 1), so uid — never id — is the primary key."
        },
        "repo": { "type": "string" },
        "id": {
          "description": "The item's own anchored <!-- id:XXXX --> token, or null for an id-less line.",
          "anyOf": [{ "type": "string", "pattern": "^[0-9a-f]{4}$" }, { "type": "null" }]
        },
        "identity": { "enum": ["tracked", "untracked"] },
        "kind": { "enum": ["ledger_item", "review_box"] },
        "title": { "type": "string" },
        "body": { "type": "string" },
        "todo_status": {
          "enum": ["open", "done", "absent"],
          "description": "The TODO.md/TODO.archive.md view's checkbox state. NEVER collapsed with roadmap_status."
        },
        "roadmap_status": {
          "enum": ["open", "done", "absent"],
          "description": "The ROADMAP.md/ROADMAP.archive.md view's checkbox state. NEVER collapsed with todo_status."
        },
        "review_status": {
          "enum": ["open", "done", "absent"],
          "description": "The REVIEW_ME.md view's box state — a third view, not folded into either ledger view."
        },
        "drift": {
          "type": "boolean",
          "description": "true iff both ledger views are present and disagree. This is the single-id-two-views drift orphan-scan.sh --cross-ledger reports; the board is the first place it is visible."
        },
        "derived_status": {
          "enum": ["backlog", "queued", "done", "needs-decision"],
          "description": "DERIVED for adapters only, never authoritative. An OPEN view always beats a DONE view, so a drifting item is never rendered done."
        },
        "labels": { "type": "array", "items": { "type": "string" } },
        "assignee": {
          "anyOf": [{ "enum": ["executor", "apex", "human", "daemon"] }, { "type": "null" }]
        },
        "parent": { "anyOf": [{ "type": "string" }, { "type": "null" }] },
        "children": { "type": "array", "items": { "type": "string" } },
        "blocked_by": { "type": "array", "items": { "type": "string" } },
        "links": { "type": "array", "items": { "$ref": "#/$defs/link" } },
        "fields": {
          "type": "object",
          "description": "The Acceptance / Tests / Done-check / Context sub-bullets.",
          "additionalProperties": { "type": "string" }
        },
        "archived": { "type": "boolean" },
        "section": { "anyOf": [{ "type": "string" }, { "type": "null" }] },
        "section_gated": { "type": "boolean" },
        "owner_accepted": {
          "anyOf": [{ "type": "string", "pattern": "^\\d{4}-\\d{2}-\\d{2}$" }, { "type": "null" }],
          "description": "@owner-accepted:YYYY-MM-DD — owner-only; an importer never writes it, it only carries what the ledger says."
        },
        "sources": {
          "type": "array",
          "items": { "$ref": "#/$defs/source" }
        }
      }
    },
    "link": {
      "type": "object",
      "required": ["kind"],
      "additionalProperties": true,
      "properties": {
        "kind": { "enum": ["routed", "settles", "decided-in"] },
        "token": { "anyOf": [{ "type": "string", "pattern": "^[0-9a-f]{4}$" }, { "type": "null" }] },
        "target_uid": {
          "anyOf": [{ "type": "string" }, { "type": "null" }],
          "description": "null until fleet-level resolution. A routed token resolving to >=2 repos is a class-B collision and is FATAL."
        },
        "path": { "type": "string" }
      }
    },
    "source": {
      "type": "object",
      "required": ["file", "line", "view"],
      "additionalProperties": true,
      "properties": {
        "file": { "type": "string" },
        "line": { "type": "integer", "minimum": 1 },
        "view": { "enum": ["todo", "roadmap", "review"] },
        "archived": { "type": "boolean" }
      }
    },
    "unmapped": {
      "type": "object",
      "required": ["construct", "file", "line", "text", "reason"],
      "additionalProperties": false,
      "properties": {
        "construct": { "type": "string" },
        "file": { "type": "string" },
        "line": { "type": "integer", "minimum": 1 },
        "text": { "type": "string" },
        "reason": { "type": "string" }
      }
    }
  }
}
