{
  "items": [
    {
      "archived": false,
      "assignee": "apex",
      "blocked_by": [],
      "body": "[HARD] Item OPEN in TODO, DONE in ROADMAP — the cross-ledger drift case <!-- children-of:4a5c --> <!-- id:1111 -->\n  - **Acceptance** both statuses survive the round-trip\n  - **Tests** tests/test_tracker_schema_drift_roundtrip.sh",
      "children": [],
      "derived_status": "backlog",
      "drift": true,
      "fields": {
        "acceptance": "both statuses survive the round-trip",
        "tests": "tests/test_tracker_schema_drift_roundtrip.sh"
      },
      "id": "1111",
      "identity": "tracked",
      "kind": "ledger_item",
      "labels": [
        "drift:cross-ledger",
        "lane:hard"
      ],
      "links": [],
      "owner_accepted": null,
      "parent": "repo-alpha/4a5c",
      "repo": "repo-alpha",
      "review_status": "absent",
      "roadmap_status": "done",
      "section": "ledger substrate",
      "section_gated": false,
      "sources": [
        {
          "archived": false,
          "file": "TODO.md",
          "line": 8,
          "view": "todo"
        },
        {
          "archived": false,
          "file": "ROADMAP.md",
          "line": 5,
          "view": "roadmap"
        }
      ],
      "title": "Item OPEN in TODO, DONE in ROADMAP — the cross-ledger drift case",
      "todo_status": "open",
      "uid": "repo-alpha/1111"
    },
    {
      "archived": false,
      "assignee": "executor",
      "blocked_by": [],
      "body": "[ROUTINE] Item DONE in TODO, OPEN in ROADMAP — drift in the other direction <!-- id:2222 -->",
      "children": [],
      "derived_status": "queued",
      "drift": true,
      "fields": {},
      "id": "2222",
      "identity": "tracked",
      "kind": "ledger_item",
      "labels": [
        "drift:cross-ledger",
        "lane:routine"
      ],
      "links": [],
      "owner_accepted": null,
      "parent": null,
      "repo": "repo-alpha",
      "review_status": "absent",
      "roadmap_status": "open",
      "section": "ledger substrate",
      "section_gated": false,
      "sources": [
        {
          "archived": false,
          "file": "TODO.md",
          "line": 11,
          "view": "todo"
        },
        {
          "archived": false,
          "file": "ROADMAP.md",
          "line": 6,
          "view": "roadmap"
        }
      ],
      "title": "Item DONE in TODO, OPEN in ROADMAP — drift in the other direction",
      "todo_status": "done",
      "uid": "repo-alpha/2222"
    },
    {
      "archived": false,
      "assignee": "apex",
      "blocked_by": [
        "repo-alpha/1111"
      ],
      "body": "[HARD] Item open in both ledgers, no drift <!-- gated-on:1111 --> <!-- id:3333 -->",
      "children": [],
      "derived_status": "queued",
      "drift": false,
      "fields": {},
      "id": "3333",
      "identity": "tracked",
      "kind": "ledger_item",
      "labels": [
        "has:review-box",
        "lane:hard"
      ],
      "links": [],
      "owner_accepted": null,
      "parent": null,
      "repo": "repo-alpha",
      "review_status": "open",
      "roadmap_status": "open",
      "section": "ledger substrate",
      "section_gated": false,
      "sources": [
        {
          "archived": false,
          "file": "TODO.md",
          "line": 12,
          "view": "todo"
        },
        {
          "archived": false,
          "file": "ROADMAP.md",
          "line": 7,
          "view": "roadmap"
        },
        {
          "archived": false,
          "file": "REVIEW_ME.md",
          "line": 3,
          "view": "review"
        }
      ],
      "title": "Item open in both ledgers, no drift",
      "todo_status": "open",
      "uid": "repo-alpha/3333"
    },
    {
      "archived": false,
      "assignee": "executor",
      "blocked_by": [],
      "body": "[ROUTINE] Item done in both ledgers <!-- id:4444 -->",
      "children": [],
      "derived_status": "done",
      "drift": false,
      "fields": {},
      "id": "4444",
      "identity": "tracked",
      "kind": "ledger_item",
      "labels": [
        "lane:routine"
      ],
      "links": [],
      "owner_accepted": null,
      "parent": null,
      "repo": "repo-alpha",
      "review_status": "absent",
      "roadmap_status": "done",
      "section": "ledger substrate",
      "section_gated": false,
      "sources": [
        {
          "archived": false,
          "file": "TODO.md",
          "line": 13,
          "view": "todo"
        },
        {
          "archived": false,
          "file": "ROADMAP.md",
          "line": 8,
          "view": "roadmap"
        }
      ],
      "title": "Item done in both ledgers",
      "todo_status": "done",
      "uid": "repo-alpha/4444"
    },
    {
      "archived": false,
      "assignee": "human",
      "blocked_by": [],
      "body": "[INPUT — meeting] Lives only in TODO — roadmap_status must be `absent`, not `open` <!-- id:5555 -->",
      "children": [],
      "derived_status": "backlog",
      "drift": false,
      "fields": {},
      "id": "5555",
      "identity": "tracked",
      "kind": "ledger_item",
      "labels": [
        "input:meeting",
        "lane:input"
      ],
      "links": [],
      "owner_accepted": null,
      "parent": null,
      "repo": "repo-alpha",
      "review_status": "absent",
      "roadmap_status": "absent",
      "section": "ledger substrate",
      "section_gated": false,
      "sources": [
        {
          "archived": false,
          "file": "TODO.md",
          "line": 14,
          "view": "todo"
        }
      ],
      "title": "Lives only in TODO — roadmap_status must be absent, not open",
      "todo_status": "open",
      "uid": "repo-alpha/5555"
    },
    {
      "archived": false,
      "assignee": "daemon",
      "blocked_by": [],
      "body": "[MECHANICAL] [INTENSIVE — local-llm] [host:zomni] Composed capability + resource + host tags <!-- id:6666 -->",
      "children": [],
      "derived_status": "backlog",
      "drift": false,
      "fields": {},
      "id": "6666",
      "identity": "tracked",
      "kind": "ledger_item",
      "labels": [
        "host:zomni",
        "lane:mechanical",
        "resource:local-llm"
      ],
      "links": [],
      "owner_accepted": null,
      "parent": null,
      "repo": "repo-alpha",
      "review_status": "absent",
      "roadmap_status": "absent",
      "section": "ledger substrate",
      "section_gated": false,
      "sources": [
        {
          "archived": false,
          "file": "TODO.md",
          "line": 15,
          "view": "todo"
        }
      ],
      "title": "Composed capability + resource + host tags",
      "todo_status": "open",
      "uid": "repo-alpha/6666"
    },
    {
      "archived": false,
      "assignee": "human",
      "blocked_by": [],
      "body": "[HARD — hands] Legacy venue-keyed lane with NO 1:1 successor — must map to input:unresolved-hands and be REPORTED <!-- id:7777 -->",
      "children": [],
      "derived_status": "backlog",
      "drift": false,
      "fields": {},
      "id": "7777",
      "identity": "tracked",
      "kind": "ledger_item",
      "labels": [
        "input:unresolved-hands",
        "lane:input",
        "vocab:legacy"
      ],
      "links": [],
      "owner_accepted": null,
      "parent": null,
      "repo": "repo-alpha",
      "review_status": "absent",
      "roadmap_status": "absent",
      "section": "ledger substrate",
      "section_gated": false,
      "sources": [
        {
          "archived": false,
          "file": "TODO.md",
          "line": 16,
          "view": "todo"
        }
      ],
      "title": "Legacy venue-keyed lane with NO 1:1 successor — must map to input:unresolved-hands and be REPORTED",
      "todo_status": "open",
      "uid": "repo-alpha/7777"
    },
    {
      "archived": false,
      "assignee": "apex",
      "blocked_by": [],
      "body": "[HARD — pool] Legacy pool lane — 1:1 rename to [HARD] <!-- children:3333,4444 --> <!-- id:8888 -->",
      "children": [
        "repo-alpha/3333",
        "repo-alpha/4444"
      ],
      "derived_status": "backlog",
      "drift": false,
      "fields": {},
      "id": "8888",
      "identity": "tracked",
      "kind": "ledger_item",
      "labels": [
        "lane:hard",
        "venue:pool",
        "vocab:legacy"
      ],
      "links": [],
      "owner_accepted": null,
      "parent": null,
      "repo": "repo-alpha",
      "review_status": "absent",
      "roadmap_status": "absent",
      "section": "ledger substrate",
      "section_gated": false,
      "sources": [
        {
          "archived": false,
          "file": "TODO.md",
          "line": 17,
          "view": "todo"
        }
      ],
      "title": "Legacy pool lane — 1:1 rename to",
      "todo_status": "open",
      "uid": "repo-alpha/8888"
    },
    {
      "archived": false,
      "assignee": "human",
      "blocked_by": [],
      "body": "[ROUTINE] @manual @needs-auth Human must run it AND supply a secret <!-- id:9999 -->",
      "children": [],
      "derived_status": "backlog",
      "drift": false,
      "fields": {},
      "id": "9999",
      "identity": "tracked",
      "kind": "ledger_item",
      "labels": [
        "lane:routine",
        "marker:manual",
        "marker:needs-auth"
      ],
      "links": [],
      "owner_accepted": null,
      "parent": null,
      "repo": "repo-alpha",
      "review_status": "absent",
      "roadmap_status": "absent",
      "section": "ledger substrate",
      "section_gated": false,
      "sources": [
        {
          "archived": false,
          "file": "TODO.md",
          "line": 18,
          "view": "todo"
        }
      ],
      "title": "@manual @needs-auth Human must run it AND supply a secret",
      "todo_status": "open",
      "uid": "repo-alpha/9999"
    },
    {
      "archived": false,
      "assignee": "executor",
      "blocked_by": [],